{
  "schema": "heisentick/validation-run-request",
  "version": 1,
  "requestKey": "0f3c1d2e-4a5b-4c6d-8e9f-0a1b2c3d4e5f",
  "kind": "validate",
  "strategyId": "ict2tfFvgXauusd1h5m",
  "route": {
    "symbol": "XAUUSD",
    "timeframe": "5m",
    "rangeMethod": "zone"
  },
  "costMode": "realistic",
  "window": {
    "from": "2020-01-01",
    "to": "2026-09-01"
  },
  "monteCarloIterations": 5000
}
